{
  "summary": "Fictional sample: the student practiced story sequencing, shared materials and counted objects in guided play.",
  "domains": {
    "Communication": "Retold a familiar story in an observed small-group activity.",
    "Literacy": "Recognised letters in a fictional observation.",
    "Numeracy": "Counted ten objects during a mock lesson.",
    "Social-emotional": "Shared blocks with peers during a demonstration activity.",
    "Creative expression": "Created shapes from coloured paper in pretend play."
  },
  "nextSteps": "Educator to confirm whether to continue storytelling and group construction opportunities.",
  "evidenceIds": [
    "ST-001-E01",
    "ST-001-E02"
  ]
}
